pid,pname,descr
1,"Weather Forecasting","This project aims to forecast the weather."
2,"Marketing Campaign","This project involves creating and executing marketing strategies to increase brand awareness."
3,"Product Development","This project aims to develop a new product line to meet market demands."
4,"Website Redesign","This project involves redesigning the company website to improve usability and functionality."
5,"Data Analysis","This project focuses on analyzing large datasets to extract meaningful insights."
6,"Customer Relationship Management","This project aims to implement a CRM system to better manage customer interactions."
7,"Training Program","This project involves developing and implementing a training program for employees."
8,"Supply Chain Optimization","This project focuses on optimizing the supply chain to reduce costs."
9,"Quality Assurance","This project aims to implement quality assurance processes to ensure product reliability."
10,"Research and Development","This project involves conducting research to innovate and develop new products."
11,"Event Planning","This project involves planning and organizing corporate events to engage clients."
12,"Financial Analysis","This project focuses on analyzing financial data to assess performance."
13,"Content Creation","This project involves creating engaging content for marketing campaigns."
14,"Human Resources Management","This project aims to streamline HR processes and improve employee satisfaction."
15,"E-commerce Platform Development","This project involves developing an e-commerce platform."
16,"Customer Feedback Survey","This project aims to gather customer feedback to identify areas for improvement."
17,"Inventory Management System","This project involves implementing an inventory management system."
18,"Public Relations Campaign","This project involves developing and executing PR strategies."
19,"Healthcare IT Integration","This project aims to integrate various healthcare IT systems."
20,"Sustainability Initiative","This project focuses on implementing sustainable practices."
21,"Training and Development","This project involves providing training and development opportunities."
22,"Mobile App Development","This project aims to develop a mobile application."
23,"Risk Management","This project focuses on identifying and mitigating risks."
24,"Digital Marketing Strategy","This project involves developing and implementing digital marketing strategies."
25,"Facility Expansion","This project aims to expand company facilities."
26,"Cybersecurity Enhancement","This project involves strengthening cybersecurity measures."
27,"Customer Support Improvement","This project aims to enhance customer support services."
28,"Social Media Management","This project involves managing and optimizing social media channels."
29,"IT Infrastructure Upgrade","This project aims to upgrade IT infrastructure."
30,"Product Launch","This project involves planning and executing the launch of a new product."
31,"Strategic Planning","This project focuses on developing long-term strategic plans."
32,"Community Outreach Program","This project involves engaging with the local community."
33,"Market Research","This project aims to conduct market research."
34,"Employee Wellness Program","This project involves implementing wellness programs."
35,"Digital Transformation","This project focuses on digitally transforming business processes."
36,"Brand Identity Development","This project involves developing brand identity."
37,"Product Testing and QA","This project aims to conduct product testing and QA."
38,"Community Development Initiative","This project involves collaborating with local communities."
39,"Market Expansion Strategy","This project aims to expand market reach."
40,"Employee Training Portal","This project involves developing an online training portal."
41,"Corporate Social Responsibility","This project focuses on corporate social responsibility."
42,"Sales Performance Optimization","This project aims to optimize sales performance."
43,"Disaster Recovery Plan","This project involves developing a disaster recovery plan."
44,"Brand Awareness Campaign","This project involves creating campaigns for brand awareness."
45,"Remote Work Infrastructure","This project aims to establish remote work infrastructure."
46,"Digital Content Strategy","This project involves developing a digital content strategy."
47,"Customer Retention Program","This project aims to implement customer retention strategies."
48,"Compliance and Regulations","This project focuses on compliance and regulations."
49,"New Product Launch","This project involves launching a new product line to meet market demand."
50,"Website Maintenance","This project focuses on maintaining and updating the company website to ensure optimal performance."
